<?xml version="1.0" encoding="UTF-8" standalone="no"?>
<!-- LUIS DAVID DIAZ MESA
SERGIO MONTALBÁN ATENCIA-->
<examen
    xmlns:xsi="http://www.w3.org/2001/XMLSchema-instance"
    xsi:noNamespaceSchemaLocation="examen.xsd">

    <!-- TIPO TEST -->
    <pregunta nombre="Luis David" primerApellido="Diaz">
        <id id="P1"></id>
        <enunciado>
             <!-- ESTO ES UN EJEMPLO-->
        </enunciado>
        <p_test tipo="unica">
            <A> <!-- ESTO ES UN EJEMPLO--></A>
            <B> <!-- ESTO ES UN EJEMPLO--></B>
            <C> <!-- ESTO ES UN EJEMPLO--></C>
        </p_test>
    </pregunta>

    <!-- TIPO NUMERICA-->
    <pregunta nombre="Luis David" primerApellido="Diaz">
        <id id="P2"></id>
        <enunciado>
            ¿Cuántos atributos puede tener la declaración :element en xsd? 
        </enunciado>
        <p_numerica min="0" max="7"></p_numerica>
        <enunciado>
            ¿Cuáles son? Explica para que sirven.
        </enunciado>
        <p_libre numfilas="16" numcol="1"></p_libre>
    </pregunta>

    <!-- TIPO ORDENAMIENTO-->
    <pregunta nombre="Luis David" primerApellido="Diaz">
        <id id="P3"></id>
        <enunciado>
            <!-- ESTO ES UN EJEMPLO-->
        </enunciado>
        <p_ordenar>
            <opcion2> <!-- ESTO ES UN EJEMPLO--></opcion2>
            <opcion1> <!-- ESTO ES UN EJEMPLO--></opcion1>
            <opcion4> <!-- ESTO ES UN EJEMPLO--></opcion4>
            <opcion3> <!-- ESTO ES UN EJEMPLO--></opcion3>
        </p_ordenar>
    </pregunta>

    <!-- TIPO BOOLEANA-->
    <pregunta nombre="Luis David" primerApellido="Diaz">
        <id id="P4"></id>
        <enunciado>
            ¿Se puede declarar un atributo si este modifica el valor del elemento?
        </enunciado>
        <p_booleana respuesta="si"></p_booleana>
        <enunciado>
            Justifica tu respuesta 
        </enunciado>
        <p_libre numfilas="3" numcol="1"></p_libre>
    </pregunta>

    <!-- TIPO LIBRE-->
    <pregunta nombre="Luis David" primerApellido="Diaz">
        <id id="P5"></id>
        <enunciado>
            ¿Qué atributos puede tener la declaración :attribute en xsd? Explica para que sirven.
        </enunciado>
        <p_libre numfilas="12" numcol="1"></p_libre>
    </pregunta>
    
    <!-- TIPO NUMERICA -->
    <pregunta nombre="Luis David" primerApellido="Diaz">   
        <id id="P6" />
        <enunciado>¿Qué nota le pondrías a esta práctica?</enunciado>
        <p_numerica min="5" max="10" />
    </pregunta>
</examen>